{"$schema":"https://json-schema.org/draft/2020-12/schema","$id":"https://mindclade.dev/schemas/artifact-manifest/v1","title":"ArtifactManifest","type":"object","additionalProperties":false,"required":["schema_version","kind","metadata","spec","lineage","integrity"],"properties":{"schema_version":{"const":"mindclade.artifact-manifest/v1"},"kind":{"const":"ArtifactManifest"},"metadata":{"$ref":"#/$defs/metadata"},"spec":{"type":"object","additionalProperties":false,"required":["artifact"],"properties":{"artifact":{"$ref":"#/$defs/artifact"}}},"lineage":{"type":"array","items":{"$ref":"#/$defs/artifact"}},"integrity":{"$ref":"#/$defs/integrity"}},"$defs":{"digest":{"type":"string","pattern":"^sha256:[a-f0-9]{64}$"},"metadata":{"type":"object","additionalProperties":false,"required":["uid","created_at","owner"],"properties":{"uid":{"type":"string","minLength":1},"created_at":{"type":"string","format":"date-time"},"owner":{"type":"string","minLength":1}}},"artifact":{"type":"object","additionalProperties":false,"required":["digest","media_type","size_bytes","kind"],"properties":{"digest":{"$ref":"#/$defs/digest"},"media_type":{"type":"string","minLength":1},"size_bytes":{"type":"integer","minimum":0},"kind":{"type":"string","minLength":1}}},"integrity":{"type":"object","additionalProperties":false,"required":["payload_digest","signatures"],"properties":{"payload_digest":{"$ref":"#/$defs/digest"},"signatures":{"type":"array","items":{"type":"string","minLength":1}}}}}}
