{"schema_version":"mindclade.artifact-manifest/v1","kind":"ArtifactManifest","metadata":{"uid":"artifact-1","created_at":"2026-08-30T00:00:00Z","owner":"data-platform"},"spec":{"artifact":{"digest":"sha256:aaaaaaaaaaaaaaaaaaaaaaaaaaaaaaaaaaaaaaaaaaaaaaaaaaaaaaaaaaaaaaaa","media_type":"application/json","size_bytes":1,"kind":"fixture"}},"lineage":[],"integrity":{"payload_digest":"sha256:bbbbbbbbbbbbbbbbbbbbbbbbbbbbbbbbbbbbbbbbbbbbbbbbbbbbbbbbbbbbbbbb","signatures":[]}}
